{
  "entries": [
    {
      "reviewedAt": null,
      "sourceHash": "8608fb433602c562d10eb9347c53a8edbd5eeb3d09f456d8d39a663f518f3438",
      "status": "unreviewed",
      "targetHash": "59202547a955b7d5ae7a757c889bcd69b685c179efa02609bf2c99d3e2cc80ce",
      "unitId": "display:component.additional-remedy"
    },
    {
      "reviewedAt": null,
      "sourceHash": "f325f77189fdea96fc3d7a0c9fc215036fddfbd701f48d5d8ea47cace9e41d3f",
      "status": "unreviewed",
      "targetHash": "d09688fef82ed30c84bd598df04b583f7559610c6a4c4f55084079baf8897abe",
      "unitId": "display:component.appendix-table"
    },
    {
      "reviewedAt": null,
      "sourceHash": "6ccaa6415b5ee449e3c5c716f57b4608ebe3b780f5aa6b077bc5d8eee5d961f9",
      "status": "unreviewed",
      "targetHash": "d661c3d96d53ebc0ca8a55aae24b5df4a4d1bf28d37337b982fe8ebf54846eeb",
      "unitId": "display:component.body"
    },
    {
      "reviewedAt": null,
      "sourceHash": "24ab72c476f35cd1acac5776cf87b31cd8f9d4e0b697627b688eb05cd232f46f",
      "status": "unreviewed",
      "targetHash": "08260a18174e26e7f97e29861c750764c838068a7a5d98a428c702e8f53cc91f",
      "unitId": "display:component.change-log"
    },
    {
      "reviewedAt": null,
      "sourceHash": "9813fafb098c218090536790280a91ee70062a8490eb3615395ee731cdd40023",
      "status": "unreviewed",
      "targetHash": "b4d7d450f617bcaec4e5dc0d4dd308357ae13a6599e2f3851d45e265a092a4bb",
      "unitId": "display:component.definition"
    },
    {
      "reviewedAt": null,
      "sourceHash": "e68ee04dff59551b7d1ae07a2f8a00dc61d841628948da3d2781630706a05e92",
      "status": "unreviewed",
      "targetHash": "28a0205ae0200a47146bfc1e1eb7ff5f2d616b49d4c4cf5fe70cb0a1146c5631",
      "unitId": "display:component.examples"
    },
    {
      "reviewedAt": null,
      "sourceHash": "7f3d81eb0817c1bf0e04af5bc5888c49fc70fb1f11190b307c81a05f8ced39c2",
      "status": "unreviewed",
      "targetHash": "e6384697762471e1ec11c7a80680bbe82360e721104a0d50bede3a23b8798328",
      "unitId": "display:component.philosophy"
    },
    {
      "reviewedAt": null,
      "sourceHash": "5592925824dcbc66a2b37f063aab7bf32308b4a69f214034b982cc8e3d4c4225",
      "status": "unreviewed",
      "targetHash": "ea19a56e541662567008264892d8554d75c09c8865ef84e12239c16f0f1642ef",
      "unitId": "display:penalty.disqualification"
    },
    {
      "reviewedAt": null,
      "sourceHash": "8c2d7c625357fb94eb32aab65ae56a15c1bcbf6f4a62c1972051b4e8978512c0",
      "status": "unreviewed",
      "targetHash": "a52309134786735d30eda1875b46fb0360faa37a01755d6a9612439f735d4811",
      "unitId": "display:penalty.game-loss"
    },
    {
      "reviewedAt": null,
      "sourceHash": "8dab215ff1a1699a139d7485d60823e8fd75bc53836fdedf43c72f88616e33a1",
      "status": "unreviewed",
      "targetHash": "acafd9acc8112b4f2356297465909f95f55f7f3bb77409afb62a064649e3ba6e",
      "unitId": "display:penalty.match-loss"
    },
    {
      "reviewedAt": "2026-10-04",
      "sourceHash": "115f9a035c14816bc50d2a405da02f64c0d44d0e0bf92531b53ef298d129e419",
      "status": "reviewed-modified",
      "targetHash": "484d55613910eb8c0917fe308b499d474115ced993cd002a17d7cc75254330a4",
      "unitId": "display:penalty.none"
    },
    {
      "reviewedAt": null,
      "sourceHash": "e981ddae45d8f4ca53f1ccbe613ad254a041dacf65a06026099a6302d332113b",
      "status": "unreviewed",
      "targetHash": "a8b7a4480407ac8afc27e1bb8a2a1384003aaf3b3b16407d5fade778ec2c8d39",
      "unitId": "display:penalty.warning"
    },
    {
      "reviewedAt": null,
      "sourceHash": "892f49cbde47e85b30f932bf6c456b74c0866979810427d1d34e108d80712bb5",
      "status": "unreviewed",
      "targetHash": "430713dca7d6b6bee7556906ddc954849d7f5662c5c190cbe7d0264f599b84b2",
      "unitId": "title:ipg-s2"
    },
    {
      "reviewedAt": null,
      "sourceHash": "6106adbc9d16bd94995b02ce9357564bf988679463c7f9a680574dfa271cbdb7",
      "status": "unreviewed",
      "targetHash": "d76b30a4af8c2793cec3e400cb4b30750d0acc5e0cd66257ca96272ea141a369",
      "unitId": "block:ipg-s2-c-body-g01-b001"
    },
    {
      "reviewedAt": null,
      "sourceHash": "84ec42c0c2b98ea674083b7d3d77f163724d91bdd6c0fa808921865a8edb8169",
      "status": "unreviewed",
      "targetHash": "d92c045a522ff26be8bcd3a1c378ed0b409d04a8c531be04cbc8e7402b0b4b9f",
      "unitId": "block:ipg-s2-c-body-g01-b002"
    },
    {
      "reviewedAt": null,
      "sourceHash": "2ce56ae382cec618934d2d9cbce519127a464937792c7f770edf7488b8d49574",
      "status": "unreviewed",
      "targetHash": "780bb3a71848cc9d919f6772f3d7bdb9a88099c38c4d32e0d489d929a6aa7167",
      "unitId": "block:ipg-s2-c-body-g01-b003"
    },
    {
      "reviewedAt": null,
      "sourceHash": "6900adb0c4194b893541bde270138a47a8a9ca9fe0f5db83bf217c6bd7e249d4",
      "status": "unreviewed",
      "targetHash": "db03536ddc16e23a4401f730afbba824298ca65c255060fe832c464aba65df8d",
      "unitId": "title:ipg-s2-1"
    },
    {
      "reviewedAt": null,
      "sourceHash": "a564e69aa343413fb4582329b1f52bc80c617f6e42bf15a8ef2a90760e0c54cc",
      "status": "unreviewed",
      "targetHash": "884ac61a8a5565a2e37cea31a1bcacf37d2e60fd95d07441d0d77b081723d06e",
      "unitId": "block:ipg-s2-1-c-definition-g01-b001"
    },
    {
      "reviewedAt": null,
      "sourceHash": "0da33e9dfcfdeadb49eaf46e58ad17229578000472ac303e8fbcc2925b76ef81",
      "status": "unreviewed",
      "targetHash": "522571f551279984f05b17e24358849ca6709286980cd4b827b8023c78737e48",
      "unitId": "block:ipg-s2-1-c-definition-g01-b002"
    },
    {
      "reviewedAt": null,
      "sourceHash": "d40616f3c7a04f4b092e9bb22c8b06fc7741767ffad96007131fe73b9c7c2a05",
      "status": "unreviewed",
      "targetHash": "56726d7e28360a2db2db8e93e977dbdd74395d05f86c4245cf994a1d64447c96",
      "unitId": "block:ipg-s2-1-c-definition-g02-b001"
    },
    {
      "reviewedAt": null,
      "sourceHash": "b7f4f79c9985b0eb7fdba48300397c39839d0ef625bfb56412eed19a7da6fe57",
      "status": "unreviewed",
      "targetHash": "edf1413379142e131030b8d08f48293786bfa80004b65b4e5a08d637d0048bf6",
      "unitId": "block:ipg-s2-1-c-definition-g02-b002"
    },
    {
      "reviewedAt": null,
      "sourceHash": "1db62b528345a7bc2707009ed7dc5e6763ad5f7b0102c7230dad29c9a322a00b",
      "status": "unreviewed",
      "targetHash": "96fa857c77f93d5d269c6045ee731b864fe58e8b8aa6e88b59214b27bea1a25b",
      "unitId": "block:ipg-s2-1-c-definition-g02-b003"
    },
    {
      "reviewedAt": null,
      "sourceHash": "82f66e51ff8c23b40b98700fdf20c6054dea88de4bf678a3dd53e593aa2c5a1c",
      "status": "unreviewed",
      "targetHash": "5b8b82a5a6eb89744dd7317a32fae4d1f64579fb2bb604366da3208b10bf82e6",
      "unitId": "block:ipg-s2-1-c-definition-g02-b004"
    },
    {
      "reviewedAt": null,
      "sourceHash": "8fa37739bc5a09eb23347f35d9ecc9f5bcbdea01f7d39a54244ed59a61d16bd3",
      "status": "unreviewed",
      "targetHash": "576b4f149486ac332f803af486c876b0629cf10c97eebf9c5fd324d39f88765e",
      "unitId": "block:ipg-s2-1-c-definition-g03-b001"
    },
    {
      "reviewedAt": null,
      "sourceHash": "52d906807bf72ffbbe8086342c5ed9398d204be11c97c2e9b3a984f91e1b8bf2",
      "status": "unreviewed",
      "targetHash": "e23506cfd4f68195b9889a464ae4bffe3311ea72d76438c8a9e0509afda3283e",
      "unitId": "block:ipg-s2-1-c-definition-g03-b002"
    },
    {
      "reviewedAt": null,
      "sourceHash": "ed59eec36692a2a8daafda2c5334c69833bc10cf34be899a80b3bef663f85889",
      "status": "unreviewed",
      "targetHash": "18ad21b0e00e0c4c910f9dc0c2127ecfaf7391d5996a8915f292c91759693b8a",
      "unitId": "block:ipg-s2-1-c-definition-g03-b003"
    },
    {
      "reviewedAt": null,
      "sourceHash": "9b9d4a138ff33de56e6016f41efcb44b0ed9cc95b0c59e7234feef554eb2bfd6",
      "status": "unreviewed",
      "targetHash": "38a66f381ad04f67cb813a34ea2f265e1c89c24c91c4ad551dd344d018f70d7d",
      "unitId": "block:ipg-s2-1-c-definition-g03-b004"
    },
    {
      "reviewedAt": null,
      "sourceHash": "3fa2b137b649220d8d0912da9977441838ceeae522b5718810ec1ac04b37b598",
      "status": "unreviewed",
      "targetHash": "a5e0655f7d2bf562c1513e3678e853d8cd16e9d9785a735b2eb2aa28d36b114a",
      "unitId": "block:ipg-s2-1-c-definition-g03-b005"
    },
    {
      "reviewedAt": null,
      "sourceHash": "00c0638b5780418f4d9449097140db5867a7b82cdc99712a8686404468daef0b",
      "status": "unreviewed",
      "targetHash": "b9020ae0b07bfee0407b5136826e40e88770e31d54e4ca81f595483e7cbb862f",
      "unitId": "block:ipg-s2-1-c-definition-g03-b006"
    },
    {
      "reviewedAt": null,
      "sourceHash": "9a0cf3be1b7b3f2d59a8379d9d99d636359463679f1a35b6cc3d3954161a1774",
      "status": "unreviewed",
      "targetHash": "aeb65e1655ab7cbfa9d8cc55ccaa401ec02a1cbb32892b593ccef84ab8470c22",
      "unitId": "block:ipg-s2-1-c-definition-g03-b007"
    },
    {
      "reviewedAt": null,
      "sourceHash": "2996abd70909984e889eb84a87440a3e3507579e2e6e08479111b952f523a500",
      "status": "unreviewed",
      "targetHash": "5e03d01d9564189e39f6859daedba603ac2ed4e6d58b2cb5a3290ab4d52275de",
      "unitId": "block:ipg-s2-1-c-examples-g01-b001"
    },
    {
      "reviewedAt": null,
      "sourceHash": "960e2dabf398b0d178cabd3fce5e9927c202845535d22e7cd2551ea5d1335b0f",
      "status": "unreviewed",
      "targetHash": "f786e7e0804ce97d5ff1b570c30e22059c7ca7b05f276be4e4ff938bdf5e8125",
      "unitId": "block:ipg-s2-1-c-examples-g01-b002"
    },
    {
      "reviewedAt": null,
      "sourceHash": "8384590fe2c26113609f82175a554509a8c626abf3a5c004d0ce86bfbf35f7a7",
      "status": "unreviewed",
      "targetHash": "45dcfeb3580480157f874f6ff176e3ecd52a9dc66d6b6fb1030628210214445f",
      "unitId": "block:ipg-s2-1-c-examples-g01-b003"
    },
    {
      "reviewedAt": null,
      "sourceHash": "e99c0c613a164920e2ea05e9ecf502ae734719c475ec3d304cf0fd8b3524f5c3",
      "status": "unreviewed",
      "targetHash": "8c95ea0ebc50d88820bec2d717dcbf68cb168b0b287a212b3efff900f6d09e5f",